Day,Quote,Explanation
93,"Learn to manage your attention, it is more valuable than money. Distraction is the enemy success.","Social media, notifications, and endless scrolling fragment your focus. But deep work, uninterrupted concentration, is how you learn calculus, write a great essay, or code an application. Guard your attention like treasure."
94,"Understand this: fairness doesnt exist.  You will probably only see it at home and school, but nowhere else.  Life is not fair. Work ethic, resilience, and adaptability are your real advantages.","You will face unfair teachers, coaches, sellers, government, biased systems, or lucky classmates who seem to do little but get great test scores. Do not waste energy on it is not fair. Instead channel your energy into preparation, out-thinking, and outlasting the obstacles."
95,"Start thinking like an owner, not just a participant. Ask: How can I improve this? not When will this be over?","In group projects, sports, or part-time jobs, the people who stand out are those who take responsibility for the outcome, not just the small piece they are assigned. Taking ownership builds leadership and trust."
96,"Your network is not just who you know, it is who knows you for your reliability, honesty, and work.","That coach, teacher, or neighbor who sees you show up early, help clean up, and speak respectfully? they will be the ones writing your recommendation letters or offering you your first real opportunity. Reputation is your silent resume."
97,"Money is a tool, not a goal. Learn to earn it, save it, invest it, and use it to create freedom, not just comfort.","Earning $20 mowing lawns teaches responsibility. Saving 20% teaches discipline. Investing 80% teaches compound growth. Financial literacy = future success."
98,"Emotional control is a superpower. Do not let anger, envy, or fear make decisions for you.","When someone insults you or gets something you wanted, pause. Respond with clarity, not reaction. The ability to stay calm under pressure is what separates leaders from followers.  Anger can lead to lost of trust, opportunities, and a mistake you cannot undo"
99,"Do not confuse popularity with respect. Popularity fades; respect lasts a lifetime.","Being liked might mean going along with the crowd. Respecting yourself and your own choices away from bad behavior, will keep you out of trouble and you will thank yourself later for staying out of trouble."
100,"You are not defined by your mistakes, your grades, or your current circumstances. You are defined by your response to them.","Failed a class? Got cut from the team? Said something you regret? That is data, not destiny. What matters is what you do next. Your comeback is always stronger than your setback."
101,"Your brother is not just your sibling, he is your first teammate for life. Learn to have his back, even when you disagree.","Why it matters: One day, you will both be adults facing challenges like job stress, heartbreak, big decisions. If you have built trust now, you will always have someone who truly knows you and will stand by you, no questions asked."
102,"No one else will remember your childhood like your brother. Protect that bond, it is a story that only the two of you share.","Why it matters: Years from now, you will laugh together about the time you built a fort out of couch cushions or got in trouble. Those memories become priceless, and they only exist because you were in them together."
103,"When you help your brother, you are not just helping him, you are building a future where he will help you too.  Your parents want to be very much a part of your future too, but they may not be able to help their departure.","Why it matters: If you cover for him when he needs help, he will remember it. And when you need someone to talk to or stand up for you? He will be there for you, because you showed him how to be there for each other."
104,"Friends come and go, but your brother is family forever. Choose kindness now so you have an ally for life.","Why it matters: School friends will move away or not be your friends anymore. But your brother will always be your blood. Investing in that relationship now means you will never be alone later."
105,"You do not have to agree with your brother to respect him. Treat him the way you would want your future son to treat their sibling.","Why it matters: How you act now sets the example, not just for him, but for the next generation. Be the kind of brother you would be proud to see your own child become."
106,"When the world is hard, work is hard, everyone is against you, your family will support you. Be each others safe place, not another source of stress.","Why it matters: If school is tough or someone is unkind, coming home should feel like relief, not more fighting. You can be the calm in each others life storm."
107,"One day, Mom and Dad will not be here. But you will still have each other. Start building that bridge now, before you need to cross it.","Why it matters: Parents will not always be around to mediate or support you. But if you have learned to listen, forgive, and help each other now and you will never face life's biggest moments alone."
108,"Your brother sees your flaws, and loves you anyway. That kind of loyalty is rare. Do not take it for granted.","Why it matters: Even when you are annoying, messy, or moody, your brother still calls you family. That unconditional acceptance is something money cannot buy and strangers will not give you."
109,"Teamwork at home teaches you how to work with others in the real world. If you can cooperate with your brother, you can lead anywhere.","Why it matters: Sharing chores, solving problems, or finishing a project together builds patience, communication, and trust, skills every great leader needs."
110,"You are not just brothers, you are each others legacy. The way you treat one another tells the world what kind of man you will become.","Why it matters: How you speak to, support, and stand up for your brother shows your character more than any report card or trophy ever could."
