Day,Quote,Explanation
0,"Most people spend their lives running in a rat race: work, pay bills, sleep, repeat—with no way out. The only exits are higher education, entrepreneurship, or invention. And the best time to build your escape? it is Now, while you still have time to learn, fail, and try again.","Right now, you do not have to pay rent, car payments, or food. You have hours after school that most adults would kill for. Use them to read, code, build, or study, not just scroll. The kids who master a skill or earn a degree today become the ones who own their free time tomorrow. Don’t wait for someday"
1,"Finish what you start—even if it is boring. That is how you build trust and become someone people can count on.","Imagine you are put in charge of feeding the class pet every day. If you do it faithfully—even when it is smelly or inconvenient—your teacher will trust you with bigger responsibilities, like leading a group project. People notice who follows through."
2,"Being on time shows you respect others time. One day, your job will depend on it.","If you show up late to soccer practice, your team has to wait for you. At a real job, being late means others can not do their work, and you could lose your position. Punctuality proves you are serious."
3,"Do your chores like a professional, not because Mom or Dad said so, but because you are training to be reliable in the real world.","Folding laundry neatly or taking out the trash without complaining teaches you discipline. Later, when you have a summer job cleaning offices or stocking shelves, you will already know how to do it well and will be asked to return for more work."
4,"Your future boss will not remind you twice. He will fire you and give your job and your money to someone else. Start now: listen once, do it right, and take pride in your work.","If your teacher gives instructions for a science project and you zone out, you will turn in the wrong thing. In a job, no one will hold your hand—you must pay attention the first time and give your best effort."
5,"School is not just about grades, school is your first job. Show up ready to learn, every single day.","Just like a doctor needs to study hard to save lives, you need school to build the knowledge for your future whether you become an engineer, an artist, or business owner. Skipping focus now limits your options later."
6,"Want to know what is the best way to get ahead? Make the people around you look good. Kindness and teamwork open doors.","If you help a teammate during a group presentation, even if they forgot their part, the will remember your supported them. Later, coworkers and customers will want to work with you because you make everyone feel valued."
7,"No one will care about your future like your parents do. Honor them by making wise choices.","Your parents stay up worrying if you are safe, fed, and learning. A stranger will not lose sleep over you. A stranger will not lose one dollar over you.  When you choose to improve yourself and follow the right path, you show them their love and care is not wasted."
8,"If you want to keep more of your money one day, learn to create your own business and not just work for someone elses.","If you work at a lemonade stand for someone else, you might earn $5 an hour. But if you start your own business, you keep all the profits! Owning your work means you control your schedule and your income."
9,"Fail 10 times? Try again!. Most big successes come right after the last failure you almost gave up on.","Thomas Edison tried over 1,000 times before inventing the lightbulb. If he quit at try #999, wed still be in the dark! Every mistake teaches you what not to do next time."
10,"Do not wait to be asked to help. Spot what needs to be done and do it. That is leadership.","If you see trash on the playground and pick it up without being told, your teacher will sees that you as responsible and thank you. Leaders do not wait for permission, they take initiative."
11,"Your word is your promise. If you say you will do it, then do it.  No excuses. That is how you build a good name for yourself.","If you tell a friend you will meet them at 3 p.m. and do not show up, they will stop trusting you. In business, your reputation is everything.  People only hire the people that they trust to get The job done.  If you cannot do their job you waste their time and money."
12,"Playtime is fun, but learning is a superpower. Every lesson that you learn today builds your future tomorrow.","Math helps you manage money. Reading helps you understand contracts. Science helps you solve problems. History helps you forecast the future.  These are not just school subjects, they are tools for building your life."
13,"Choose friends who lift you up, not friends that will pull you down or get you in trouble. Your circle of friends shapes your future.","If your friends skip homework to play video games and pressure you to join, you will fall behind. But if your friends study together and encourage you, you will all rise. Your future and opportunities are driven by the people you spend the most time with."
14,"Money will not come from wishing you had it  Money will come from working, saving money, and smart choices. Start small, but think big.","Instead of spending every dollar on game cards, save your money. In a few months, you will have enough to buy a book to help you progress, start a small business, or invest in better tools. Delayed gratification builds wealth."
15,"Be polite to everyone, even when no one is watching. Manners show strength, not weakness.","Saying please and thank you to the lunch lady or bus driver shows character. One day, that same kindness could impress a future employer who notices how you treat everyone, not just important people."
16,"Your parents will not always be here to fix things. Learn to solve problems now, so that you are ready later.","If your bike chain breaks, instead of waiting for Dad to fix it, try learning how yourself with his help. That problem-solving skill means you will not panic when your car breaks down at 18."
17,"A clean room, a finished homework assignment, or maybe you made your bed, these are small wins that train you for big responsibilities.","Managing little tasks builds self-discipline. A business owner did not start his career by running a company, they started by showing up on time to work, meeting deadlines, completing projects, and keeping their workspace organized."
18,"Do not just dream of success. Plan for success, work for success, and never let laziness steal your future.","Want to open a bakery? Start by baking with your mother, learning cooking secrets, and saving money. Dreams need action or they wil just stay dreams."
19,"If you see a problem, do not complain about it and try to fix it. That is how inventors and leaders are born.","Tired of cleaning dog poop?  Watch youtube videos from other people.  Learned how they fixed the problem and try some of their solutions.  Are you annoyed that your backpack hurts your shoulders? Research solutions. Solutions equals opportunities."
20,"Reading is not homework, reading is your secret weapon. The more you know about life, math, people, history and sciences, the more choices you will have in life.  There is a well known saying that knowledge is power","Books teach you how the world works, from history to finance to human behavior. Knowledge gives you freedom to choose your path, not just take whatever job is available.  Many people end up with terrible jobs as adults because they did not prepare when they were kids."
21,"Saving one dollar today teaches you to value money. One day, that habit could fund your own business.","If you save $5 a week from age 10, by 16 you will have over $1,500.  That is enough to buy supplies for a lawn-mowing business or coding course. Small habits create big results."
22,"When you are tempted to quit, remember that the person that persists wins.  Seek help, research, try different ideas, but definetly do not give up.","Learning to play the piano or guitar is hard at first. Many quit after two weeks. But if you practice daily for six months, you will play songs your friends admire. Persistence and hard work beats a person with talent."
23,"Your attitude is your choice. Choose to be helpful, positive, and hardworking as people will notice.","Two kids apply for the same summer job. One grumbles to the hiring manager about tasks; the other says to the hiring manage that he will do his best! Guess who will get hired? Energy is contagious.  Be the light."
24,"You do not need to wait for anyone's permission to be great. Start now, with what you have and where you are.","You do not need a fancy studio to draw, just use a notebook and a pen. You do not need a building to sell cookies, just ask your neighbors if they would like to buy some cookies. Greatness begins with action, not perfect conditions."
25,"Respect your teachers.  They are helping you build the foundation for your whole life.","Teachers are not just giving grades.  Teachers are teaching you how to think, communicate, and persevere. These skills matter more than any test score."
26,"Every no that someone tells you is practice for when you will get the YES that changes everything. Just keep trying.","JK Rowling the author of Harry Potter was rejected by 12 publishers before her first book was accepted. If she had stopped at no, the world would have missed her story and she would have missed her extreme wealth and fame."
27,"Take care of your body and body parts because they are the only ones that you will get. Eat well, exercise, and get 8 hours of sleep. Do not just sit on a chair all day.  A healthy you is a strong you.","You can not run a business or raise a family if you are always tired or sick. Health is your most valuable asset, protect it like it is a treasure.  As you may have already experienced, when you are sick, it is hard to even move.  If you do not have a family around to support you and help you regain your strength your situation could get even worse."
28,"Be the kind of person now that your future self will thank. Make choices today that build a life that you will be proud of.","Choosing to study instead of scrolling social media tonight means better grades, more opportunities, and less stress later. The future you is counting on the present you to use your free time wisely."
29,"Your parents gave you life, love, and lessons. Show them you listened by living with purpose.","They sacrificed sleep, money, and time so that you could thrive. The best thank you is not just words.  It is becoming someone of integrity, grit, purpose and kindness."
30,"You do not need to be the smartest.  You just need to be the most willing to learn, try, and never give up. That is how winners are made.","Some kids pick up math fast; others take longer. But the one who keeps practicing, asks questions, and tries again? That is the one who masters it and succeeds in life."
31,"Success is not about being perfect.  Success is about showing up, even when you are scared or unsure.","Trying out for the school play even if you are nervous teaches you courage. Every great person you admire once felt unready, but they did it anyway."
32,"If you want respect, earn it through your actions, not your words.","Saying you are responsible means nothing. Completing your assigned tasks, helping without being asked, and keeping your promises, that is how people learn to trust you and respect you."
33,"Do not compare your current situation to someone elses. Everyone has to start somewhere.","Your friend might seem like a math genius, but maybe they have had a paid tutor for years. Focus on your own growth, you are exactly where you need to be to begin your own path."
34,"The more you give your time, your kindness, your effort, the more that you will receive in return.","When you help a classmate understand homework, you reinforce your own learning and you learn to teach. Generosity builds strong relationships and opens unexpected doors."
35,"Your habits today become your life tomorrow. Choose them wisely.","Scrolling for hours every night night may feel relaxing now, but you are robbing yourself of an opportunity to be learning a valuable skill. Reading, learning piano, or another skill builds a sharper you with a brighter future."
36,"No one succeeds alone. Learn to ask for help, listen to advice, and thank those who support you.","Even the best athletes have coaches with lots of experience. Asking your teacher for extra help is not weakness, it is wisdom. Gratitude keeps good people in your life."
37,"If you would not want your parents or your future boss to see it, then do not say it, or do it.","Things you say about your parents, friends or school mates can follow you for years. Build a reputation you will be proud of, not one you will have to explain later."
38,"Hard work beats talent when talent does not work hard.","You might not be the fastest runner, but if you train every day while others skip practice, you will pass them. Effort and practice helps a lot."
39,"Own your mistakes. Say I was wrong, then fix it. That is true strength.","If you break a window playing ball, do not hide it.  Instead apologize and offer to help pay. People forgive mistakes and they remember how you handled them."
40,"Your mind is a muscle. Challenge it daily with new ideas, books, and questions.","Just like lifting weights builds your arms, solving puzzles, debating ideas, or learning a language builds your brain. A strong mind creates opportunity."
41,"Do not wait to feel ready. Start before you are ready, that is how you grow.","You will not feel 100% confident before presenting your first school project, job interview or business pitch. But action builds confidence, not the other way around."
42,"Treat every task like it matters, even the small ones. Excellence is a habit, and something that you have to get used to.","Wiping the table after dinner seems tiny, but doing it well shows you care. Future employers notice the people who do the little things right."
43,"Your time is your most valuable resource. Spend it on things that build your future, not just things that entertain you.","An hour of video games vanishes. An hour learning to code, play the piano, cook, or draw builds a skill you will use for life. Invest your time like its money."
44,"Speak with honesty, but also with kindness. Truth without compassion can hurt.","Telling a friend their drawing looks bad is not helpful. Instead say, I like your colors, have you tried this technique?  Give them a compliment on what you like, and some options to do it better."
45,"Be curious, do not judge others. Ask why, instead of making assumptions.","Instead of saying, he is weird, ask what is this story? Curiosity leads to understanding, innovation, and better friendships."
46,"Sometimes you can not control what happens to you, but you always control how you respond.","If you fail a test, you can be sad, or you can ask for help and study better next time. Your response to a problem defines your character."
47,"Gratitude turns what you have into enough, and opens your eyes to more.","Instead of complaining you do not have the latest phone, be thankful you have one that works. Grateful people attract more good things."
48,"Do not let fear of failure stop you from trying. Regret hurts more than failure ever will.","You will forget the pain of failing. But you will always wonder if you should kept trying."
49,"Keep promises to yourself too. If you say you will study at 7, show up for yourself.","Breaking your own commitments teaches you not to trust yourself. Keeping them builds self-respect, the foundation of all success."
50,"The world rewards problem solvers. Train yourself to see challenges as puzzles to unlock.","Stuck on homework? do not quit, look it up, ask for help, try a new way. Every puzzle you solve gives you experience and makes you sharper for the next one."
51,"Stand for something, even when it is unpopular. Integrity means doing right when no one is watching.","If your friends are cheating on a test, do not cheat too. Build a life you can be proud of."
52,"Your energy is contagious. Bring positivity, focus, and enthusiasm wherever you go.","A grumpy teammate brings the whole group down. But your smile and a let us do this attitude can lift everyone up. Be the spark."
53,"Learn to manage money before you have a lot of it. Budgeting is a superpower.","Track your money: save 80%, spend 20%. This habit will protect you from debt and help you build wealth one day."
54,"Do not confuse comfort with happiness. Personal growth happens outside of your comfort zone.","It is easier to stay in bed or scroll on your phone rather than exercise or work. But after you accomplish something you will feel pride of your accomplishment. That is real joy, earned through effort."
55,"Be the person who finishes strong, not just starts excited.","Everyone is excited on Day 1 of a project. The ones who win are still working hard on Day 30 when others have quit."
56,"Your words have power. Use them to encourage, clarify, and inspire, not to destroy or insult people.","A kind word can change someones whole day. A cruel one can haunt them for years. Speak like your words matter, because they do."
57,"Take responsibility for your education. No one can learn for you.","Your teacher can not force you to pay attention. Your future depends on what you choose to absorb today. Be the Doctor or business owner by your own learning."
58,"Build your name like a brand: be known for honesty, hard work, and reliability.","When people hear your name, what do they think? He always delivers! He has integrity! That reputation is worth more than money."
59,"Help at home without being asked. Your family is your first team.","Setting the table, helping pick up thrash on the floor, cleaning a dirty dish, checking on your little brother, or folding laundry shows love in action. Strong families build strong people."
60,"You are writing your story every day with choosing how to spend your day. Make it one worth telling.","One day, you will look back and say, I worked hard, honored my parents, never gave up, and built something meaningful. Start writing that story now."
61,"Do not wait for motivation, build discipline. Motivation fades; discipline delivers.","You will not always feel like doing homework or practicing piano. But showing up anyway, even when you do not want to, is how champions are made."
62,"Your reputation is built over a long time but lost in seconds. Guard it like gold.","One rude comment in class, one dishonest act, can undo years of trust. Always ask: Will this honor my name and my family?"
63,"If you want to lead, learn to serve first. Great leaders lift others up.","Helping a new student find their classroom or sharing your notes shows leadership is not about titles, it is about care and action."
64,"Boredom is a gift. it is where creativity and big ideas are born.","Instead of reaching for your phone when you are bored, ask yourself, What can I build, draw, or solve?  Some of the best inventions started in quiet moments."
65,"Never lie to make yourself look better. Truth builds lasting respect.","Saying you finished your project when you did not might save you today, but when the truth comes out, no one will believe you tomorrow. Honesty is better in the long run."
66,"Take care of your things, your books, your clothes, your tools. Respect for possessions shows self-respect.","A student who keeps their backpack organized and homework neat shows they value their work. People notice, and trust you with more."
67,"You do not need permission to be kind. Be the first to smile, include others, or help.","See someone eating alone at lunch? Invite them. Kindness costs nothing but changes everything, for them and for you."
68,"Your future is built on the habits you repeat when no one is watching.","Do you read instead of scroll on your phone?  Do you review notes after class? Those quiet choices compound into success no one else sees coming."
69,"Do not blame others for your mistakes. Own them, learn, and grow.","If you forget your science project, do not say, my dog ate it. Say, I forgot it or I did not do it, but I will hard to get it done tonight and bring it in tomorrow.  That is maturity."
70,"The best investment you will ever make is in yourself, your mind, your health, and your character.","Spending money on a coding course, a Piano course, or healthy food pays dividends for life. You are your greatest asset."
71,"Stay humble in success, gracious in failure. How you handle both defines you.","Did you win a game at schoool?  Thank your teammates. Lost a game? Shake hands and say, that was a good game.  True character shows in victory and defeat."
72,"Do not chase shortcuts. The long way, earned through effort, is the only path that lasts.","Copying homework might get you a grade today, but you will struggle on the test, and later in life. Real success can not be faked."
73,"Listen more than you speak. You learn nothing when you are talking.","At school, at work, or team meeting, the person who listens carefully often has the best ideas. Wisdom starts with silence."
74,"Your attitude in tough moments matters more than your talent.","When the team is losing or the project is hard, your calm focus can steady everyone. Leaders show up strongest when things get hard."
75,"Be proud of your effort, not just your results.","You might not win the race, but if you trained hard and gave your all, you have already succeeded. Effort is always within your control."
76,"Do not let jealousy steal your joy. Celebrate others wins, they do not dim your light.","Your friend got the lead role? Be happy for them. There is enough success for everyone. Scarcity thinking holds you back."
77,"Ask What can I learn? instead of Why is this happening to me?","When you fail a quiz, do not complain, ask What did I miss? How can I improve? That mindset turns failure into success."
78,"Keep your promises to your siblings, family and friends. Trust starts at home.","If you say you will play with your brother after homework, do it. Being dependable in small things prepares you for big ones.  No one will make you the boss, until you have proved the business that they can count on you"
79,"Do not confuse being busy with being productive. Focus on what truly moves you forward.","Filling your day with YouTube and chores you rush through is not progress. One hour of deep focus beats three hours of distraction."
80,"Stand by your values, even when it costs you something.","If your friends are being mean to another kid, and you choose not to follow them, you may lose some friends. But you will sleep peacefully knowing you stayed true to yourself."
81,"Your hands can build, fix, create, or help. Keep them ready to do good work.","Whether it is helping your mother cook, coding an app, or helping your father work around the house, your ability to help is your power."
82,"Do not let fear of what others think stop you from being your best self.","Wearing glasses, loving math, or starting a small business might seem uncool to some. But the right people will admire your courage.  And the value you get is unbeatable."
83,"Every expert was once a beginner. Practice makes perfect and builds experience.  Start before you feel ready.","The chef who owns a restaurant once burned toast. The coder who built an app once struggled with a simple Hello World application. Begin where you are."
84,"Be early, not just on time. Early shows eagerness and respect.","Arriving 10 minutes early to sports practice or an appointment means that you are ready to help get things ready to start. In life, the early bird doesnt just get the worm, they earn trust."
85,"Your home is your training ground. Treat it with care, respect, and gratitude.","Cleaning without complaining, speaking kindly, and helping out is not just chores, it is practice for running your own life one day."
86,"Do not gossip. If you would not say something to someone's face, do not say it behind their back.","Gossip might feel fun in the moment, but it breaks trust and makes people wary of you. Be known as someone who protects others dignity not someone that makes fun of others.  "
87,"Save your energy for things that matters: learning, growing, and building.","Drama, complaining, and arguing over small things drain you. Focus your fire on goals that light you up."
88,"Be the reason someone believes in kindness again.","One sincere Are you okay? can change a bad day into a hopeful one. Never underestimate the ripple of a single act of care."
89,"Your education is your launch pad, not a prison. Use it to explore, question, and dream.","School is not just about passing tests, it is where you discover what you love, what you are good at, and how you will change the world."
90,"You are enough, but you are also a work in progress. Keep growing, every single day.","You do not have to be perfect to be worthy. But never stop learning, trying, and becoming the person your future self will admire."
91,"Your choices now are down payments on your future self. Invest wisely.","Skipping homework might feel like a win today, but it leaves knowledge holes that will limit your options in high school, college, or your first job. Every decision is a vote for the person you are becoming."
92,"No one owes you success.  not your parents, teachers, or society. You earn it through consistent effort and hard work.","The world rewards value creators. If you want respect, opportunity, or income, focus on what you can give society, not what you can get. That is the mindset of builders, not bystanders."
